secid,description,founded,headquarters,employees,sector,ceo,link
SFIN,"ПАО «ЭсЭфАй» (SFI) — российская финансовая группа, специализирующаяся на инвестиционной деятельности, управлении активами и предоставлении финансовых услуг. Компания входит в состав крупного российского холдинга «Сафмар» Михаила Гуцериева и фокусируется на инвестициях в высокодоходные активы в различных секторах экономики. Основные направления деятельности включают: управление инвестиционными фондами, венчурные инвестиции, финансирование инфраструктурных проектов и развитие финансовых технологий. Группа активно участвует в финансировании проектов в сфере недвижимости, энергетики и IT. Особое внимание уделяется цифровизации финансовых услуг и внедрению инновационных решений в области финтеха. Компания обладает значительным портфелем активов и продолжает расширять свое присутствие на российском финансовом рынке, сочетая консервативные стратегии управления рисками с инвестициями в перспективные высокотехнологичные проекты.",2016,"Москва, Россия","46,600+",Финансовые услуги,Игорь Сидоров,https://www.sfi.ru
SGZH,"ПАО «Сегежа» (ранее «Светогорск») — вертикально интегрированный лесопромышленный холдинг, входящий в группу «Инвестлеспром» и являющийся одним из лидеров российской лесной промышленности. Компания осуществляет полный цикл производства - от заготовки древесины до выпуска высококачественной целлюлозно-бумажной продукции. Основные производственные мощности расположены в Республике Карелия (г. Сегежа), где находится флагманское предприятие - Сегежский целлюлозно-бумажный комбинат, выпускающий мешочную бумагу, крафт-бумагу и картон. Компания специализируется на экологически чистом производстве, используя современные технологии замкнутого водооборотного цикла. «Сегежа» занимает около 30% российского рынка мешочной бумаги и активно экспортирует продукцию в 50 стран мира. В 2022 году компания запустила масштабную программу модернизации производства с инвестициями более 20 млрд рублей, направленную на увеличение мощности до 300 тыс. тонн продукции в год и внедрение инновационных решений в области глубокой переработки древесины.",2014,"Москва, Россия","20,000+",Лесная промышленность,Михаил Шамолин,https://segezha-group.com
SIBN,"ПАО «Газпром нефть» — одна из крупнейших вертикально интегрированных нефтяных компаний России, входящая в состав ПАО «Газпром». Компания осуществляет полный цикл операций — от разведки и добычи до переработки и сбыта нефтепродуктов. Основные месторождения расположены в Ханты-Мансийском и Ямало-Ненецком автономных округах, на шельфе Охотского моря (проект «Сахалин-1»), а также за рубежом (Сербия, Ирак, Венесуэла). Компания разрабатывает сложные в геологическом отношении месторождения, применяя передовые технологии, включая гидроразрыв пласта и горизонтальное бурение. «Газпром нефть» владеет современными нефтеперерабатывающими заводами (Омский НПЗ, Московский НПЗ и др.), выпускающими топливо премиум-класса. Компания активно развивает цифровые технологии (искусственный интеллект для управления месторождениями, блокчейн в логистике) и реализует масштабные арктические проекты (Приразломное месторождение). Входит в тройку лидеров по добыче нефти в России (около 60 млн тонн в год).",1995,"Санкт-Петербург, Россия","82,900+",Нефтегазовый сектор,Александр Дюков,https://www.gazprom-neft.ru
SLEN,"ПАО «Сахалинэнерго» — ведущий энергетический холдинг Сахалинской области, обеспечивающий электро- и теплоснабжение региона. Компания входит в группу «РусГидро» и объединяет генерирующие, сетевые и сбытовые активы. Основу энергосистемы составляют Южно-Сахалинская ТЭЦ-1, Сахалинская ГРЭС и разветвлённая сеть электроснабжения, включающая уникальные для России изолированные энергорайоны. Компания обслуживает более 2000 км линий электропередачи и обеспечивает энергией ключевые промышленные объекты региона, включая нефтегазовые проекты «Сахалин-1» и «Сахалин-2». Особое внимание уделяется модернизации оборудования и цифровизации процессов: внедрены интеллектуальные системы учёта, диспетчеризации и мониторинга оборудования. В условиях сложной сейсмической обстановки компания реализует специальные программы по повышению сейсмоустойчивости энергообъектов. В 2023 году начата масштабная программа перевода генерации на природный газ, что позволит значительно снизить экологическую нагрузку.",1946,"Южно-Сахалинск, Россия","2,560+",Электроэнергетика,Юров Александр,https://www.sakhalinenergo.ru
SMLT,"ГК «Самолет» — одна из ведущих российских девелоперских компаний, специализирующаяся на строительстве жилья эконом- и комфорт-класса. Компания входит в топ-5 крупнейших застройщиков России по объёмам ввода жилья и реализует проекты в Москве, Московской области и регионах. Основной акцент делается на создании комплексных жилых районов с развитой инфраструктурой — детскими садами, школами, поликлиниками и торговыми центрами. «Самолёт» применяет современные технологии строительства, включая BIM-моделирование и заводское производство элементов конструкций. Компания активно участвует в государственных программах льготной ипотеки, что делает жильё доступным для широких слоёв населения. В портфеле проектов — более 10 млн кв. м жилой недвижимости. Особое внимание уделяется качеству строительства и экологическим стандартам — все проекты сертифицируются по системе «Зелёные стандарты». В 2023 году компания запустила программу цифровизации управления жилыми комплексами с использованием технологий «умного дома».",2012,"Москва, Россия","7,000+",Девелопмент и строительство,Андрей Иваненко,https://www.samolet.ru
SNGS,"ПАО «Сургутнефтегаз» — одна из крупнейших вертикально интегрированных нефтегазовых компаний России, занимающая лидирующие позиции по объемам добычи нефти (более 60 млн тонн в год) и запасам углеводородов. Компания осуществляет полный производственный цикл: от разведки и разработки месторождений до переработки и сбыта нефтепродуктов. Основные производственные активы расположены в Ханты-Мансийском автономном округе, где компания разрабатывает более 70 месторождений с доказанными запасами нефти около 2,5 млрд баррелей. «Сургутнефтегаз» отличается уникальной финансовой политикой, поддерживая рекордные денежные резервы (свыше $50 млрд), что делает ее одной из самых финансово устойчивых компаний в отрасли. Компания владеет современными нефтеперерабатывающими мощностями (КиришиНПЗ) и развитой сбытовой сетью. Особое внимание уделяется экологическим программам и внедрению передовых технологий, включая методы увеличения нефтеотдачи пластов и цифровизацию производственных процессов.",1977,"Сургут, Россия","100,000+",Нефтегазовый сектор,Владимир Богданов,https://www.surgutneftegas.ru
SNGSP,"ПАО «Сургутнефтегаз» (прив. акции) — одна из крупнейших вертикально интегрированных нефтегазовых компаний России, занимающая лидирующие позиции по объемам добычи нефти (более 60 млн тонн в год) и запасам углеводородов. Компания осуществляет полный производственный цикл: от разведки и разработки месторождений до переработки и сбыта нефтепродуктов. Основные производственные активы расположены в Ханты-Мансийском автономном округе, где компания разрабатывает более 70 месторождений с доказанными запасами нефти около 2,5 млрд баррелей. «Сургутнефтегаз» отличается уникальной финансовой политикой, поддерживая рекордные денежные резервы (свыше $50 млрд), что делает ее одной из самых финансово устойчивых компаний в отрасли. Компания владеет современными нефтеперерабатывающими мощностями (КиришиНПЗ) и развитой сбытовой сетью. Особое внимание уделяется экологическим программам и внедрению передовых технологий, включая методы увеличения нефтеотдачи пластов и цифровизацию производственных процессов.",1977,"Сургут, Россия","100,000+",Нефтегазовый сектор,Владимир Богданов,https://www.surgutneftegas.ru
SOFL,"ПАО «Софтлайн» — ведущий российский разработчик и поставщик решений в области информационных технологий и цифровой трансформации бизнеса. Компания специализируется на внедрении ERP-систем (1С, SAP), CRM-решений, платформ для электронной коммерции и аналитических систем на базе искусственного интеллекта. Входит в топ-5 крупнейших ИТ-компаний России по версии RAEX. Основные направления деятельности включают: цифровизацию корпоративного управления, автоматизацию бизнес-процессов, разработку облачных решений и кибербезопасность. Компания обслуживает более 3000 корпоративных клиентов, включая крупнейшие предприятия нефтегазового сектора, банки и государственные структуры. «Софтлайн» активно развивает собственные R&D-центры, инвестируя в разработку отечественного программного обеспечения в рамках импортозамещения. В 2023 году компания запустила платформу для промышленного интернета вещей (IIoT) и расширила линейку решений для цифровых двойников предприятий.",1993,"Москва, Россия","11,000+",Информационные технологии,Владимир Лавров,https://www.softline.ru
SPBE,"ПАО «Санкт-Петербургская биржа» — ведущая российская фондовая биржа, занимающая второе место по объемам торгов после Московской биржи. Специализируется на организации торгов ценными бумагами, валютными операциями и производными финансовыми инструментами. Биржа играет ключевую роль в формировании цен на российские активы и является важным элементом финансовой инфраструктуры страны. Основные торговые площадки включают: рынок акций и облигаций, срочный рынок (фьючерсы и опционы), валютный рынок и товарные секции. В 2023 году биржа запустила торговлю новыми инструментами, включая криптовалютные активы в рамках экспериментального правового режима. Особое внимание уделяется развитию технологий blockchain для пост-трейдинговых операций. Биржа активно сотрудничает с азиатскими финансовыми центрами, развивая альтернативные маршруты для международных инвесторов.",1997,"Санкт-Петербург, Россия",180+,Биржевая инфраструктура,Евгений Сердюков,https://www.spbexchange.ru
STSB,"ПАО «Ставропольэнергосбыт» — крупнейшая энергосбытовая компания Ставропольского края, обеспечивающая поставки электроэнергии более чем 1,2 млн потребителей региона. Компания входит в группу «Россети» и осуществляет полный комплекс услуг на розничном рынке электроэнергии: от расчетов и обслуживания клиентов до технологического присоединения к сетям. Особое внимание уделяется цифровизации услуг: внедрены интеллектуальные системы учета электроэнергии (АИИС КУЭ), мобильное приложение для клиентов и онлайн-сервисы. Компания активно участвует в программах энергосбережения и повышения энергетической эффективности в регионе. В зоне ответственности — обслуживание более 45 тыс. юридических лиц, включая крупные промышленные предприятия и агропромышленные комплексы. «Ставропольэнергосбыт» реализует социальные программы поддержки населения и бюджетных учреждений, включая специальные тарифные условия для социально незащищенных категорий граждан.",2005,"Ставрополь, Россия",700+,Энергосбыт,Остапченко Борис,https://stavropol.tns-e.ru
STSBP,"ПАО «Ставропольэнергосбыт» (прив. акции) — крупнейшая энергосбытовая компания Ставропольского края, обеспечивающая поставки электроэнергии более чем 1,2 млн потребителей региона. Компания входит в группу «Россети» и осуществляет полный комплекс услуг на розничном рынке электроэнергии: от расчетов и обслуживания клиентов до технологического присоединения к сетям. Особое внимание уделяется цифровизации услуг: внедрены интеллектуальные системы учета электроэнергии (АИИС КУЭ), мобильное приложение для клиентов и онлайн-сервисы. Компания активно участвует в программах энергосбережения и повышения энергетической эффективности в регионе. В зоне ответственности — обслуживание более 45 тыс. юридических лиц, включая крупные промышленные предприятия и агропромышленные комплексы. «Ставропольэнергосбыт» реализует социальные программы поддержки населения и бюджетных учреждений, включая специальные тарифные условия для социально незащищенных категорий граждан.",2005,"Ставрополь, Россия",700+,Энергосбыт,Остапченко Борис,https://stavropol.tns-e.ru
SVAV,"ПАО «СОЛЛЕРС» — российская автомобилестроительная компания, специализирующаяся на производстве легковых и коммерческих автомобилей под брендами UAZ, Fiat, Isuzu и Sollers. Компания является одним из ключевых игроков российского автопрома с производственными мощностями в Ульяновске (УАЗ), Владивостоке (Mazda Sollers) и Набережных Челнах (Ford Sollers). Основная продукция включает внедорожники УАЗ, коммерческие автомобили Fiat Ducato, легковые модели Fiat и Isuzu, а также специальную технику. Компания активно развивает собственные инженерные компетенции, включая разработку новых моделей с электрическими и гибридными силовыми установками. В 2023 году запущена программа глубокой локализации производства с созданием отечественных аналогов импортных комплектующих. Особое внимание уделяется цифровизации производства и внедрению Industry 4.0. «СОЛЛЕРС» занимает около 15% рынка коммерческого транспорта в России и активно развивает экспортные поставки в страны СНГ, Ближнего Востока и Латинской Америки.",2002,"Москва, Россия",22+,Автомобилестроение,Соболев Николай,https://www.sollers-auto.com
SVCB,"ПАО «Совкомбанк» — один из крупнейших частных банков России, входящий в топ-10 банков страны по размеру активов. Банк предоставляет полный спектр финансовых услуг для частных и корпоративных клиентов, включая розничное и корпоративное кредитование, ипотеку, инвестиционные продукты и страхование. Особую известность банк получил благодаря своим инновационным цифровым продуктам, таким как кредитная карта «Халва» с функцией рассрочки, которая стала одним из самых популярных финансовых продуктов в России. Совкомбанк активно развивает экосистему финансовых услуг, включая мобильное приложение с искусственным интеллектом для управления финансами. Банк имеет одну из самых разветвленных сетей отделений в регионах России, что позволяет ему обслуживать клиентов по всей стране. В последние годы Совкомбанк активно инвестирует в технологии, включая блокчейн и машинное обучение для скоринга, что позволяет ему предлагать конкурентные условия по кредитам. Банк также развивает направление ESG-финансирования, поддерживая экологические и социальные проекты.",1990,"Москва, Россия","36,000+",Банковский сектор,Дмитрий Гусев,https://www.sovcombank.ru
