secid,description,founded,headquarters,employees,sector,ceo,link
IRKT,"ПАО «Яковлев» (IRKT) — ведущее российское авиастроительное предприятие, специализирующееся на разработке, производстве и обслуживании гражданских и военных самолетов. Компания является создателем знаменитого семейства самолетов Як, включая новейший региональный самолет МС-21 (где ПАО «Яковлев» выступает главным разработчиком). Предприятие обладает полным циклом создания авиационной техники — от проектирования до серийного производства и послепродажного обслуживания. Основные производственные мощности расположены в Иркутске, где находится один из крупнейших авиастроительных комплексов в России. Компания активно участвует в программе импортозамещения, разрабатывая отечественные аналоги ключевых авиационных компонентов. В 2023 году «Яковлев» заключил контракты на поставку 50 самолетов МС-21 для российских авиакомпаний. Предприятие также ведет разработку перспективного пассажирского самолета на 70 мест и модернизацию военно-транспортной авиации. «Яковлев» сотрудничает с ведущими техническими вузами страны, готовя кадры для авиационной промышленности и внедряя инновационные производственные технологии.",1934,"Москва, Россия (с основными производственными мощностями в Иркутске)","20,000+",Авиастроение,Андрей Богинский,https://www.yakovlev.ru
IVAT,"IVA Technologies (IVAT) — один из ведущих российских разработчиков решений для корпоративных коммуникаций и цифровой трансформации бизнеса. Компания создает полномасштабную экосистему для бизнес-взаимодействия, включающую комплексные решения для связи, коллаборации и автоматизации процессов. Основные продукты экосистемы IVA включают: корпоративный мессенджер IVA Connect с поддержкой безопасных коммуникаций, платформу видеоконференцсвязи IVA MCU, облачную ВКС-платформу «ВКурсе» для удаленной работы, AI-ассистента IVA GPT на базе генеративного ИИ, систему управления и мониторинга IVA MS, сервер корпоративной телефонии IVA CS, линейку IP-телефонов собственной разработки, профессиональные видеотерминалы IVA Room и IVA Largo для переговорных комнат, а также пограничный контроллер сессий IVA SBC для защиты VoIP-трафика. Компания ориентирована на крупный и средний бизнес, предлагая решения для банковского сектора, телекома, госструктур и промышленных предприятий. IVA Technologies активно развивает интеграцию искусственного интеллекта в свои продукты и занимает значительную долю рынка корпоративных коммуникаций в России.",2017,"Москва, Россия",500+,Корпоративные IT-решения,Станислав Иодковский,
JNOS,"ПАО «Славнефть-ЯНОС» — крупный российский нефтеперерабатывающий завод, входящий в структуру компании «Славнефть» (совместное предприятие «Роснефти» и «Газпром нефти»). Ярославский нефтеперерабатывающий завод (ЯНОС) является одним из самых современных и технологически продвинутых НПЗ в России с глубиной переработки нефти свыше 80%. Основная продукция предприятия включает высокооктановые бензины (включая марки АИ-92, АИ-95 и АИ-98), дизельное топливо стандарта Евро-5, авиационный керосин, битумы, серу и другие нефтепродукты. Завод играет ключевую роль в обеспечении топливом Центрального региона России. В последние годы на предприятии реализована масштабная программа модернизации, включающая строительство комплекса глубокой переработки нефти, что позволило значительно увеличить выпуск светлых нефтепродуктов и улучшить их качество. ЯНОС сертифицирован по международным стандартам ISO и активно внедряет экологические программы по снижению воздействия на окружающую среду.",1961,"Ярославль, Россия","3,900+",Нефтеперерабатывающая промышленность,Николай Карпов,https://www.yaroslavec.ru
JNOSP,"ПАО «Славнефть-ЯНОС» (прив. акции) — крупный российский нефтеперерабатывающий завод, входящий в структуру компании «Славнефть» (совместное предприятие «Роснефти» и «Газпром нефти»). Ярославский нефтеперерабатывающий завод (ЯНОС) является одним из самых современных и технологически продвинутых НПЗ в России с глубиной переработки нефти свыше 80%. Основная продукция предприятия включает высокооктановые бензины (включая марки АИ-92, АИ-95 и АИ-98), дизельное топливо стандарта Евро-5, авиационный керосин, битумы, серу и другие нефтепродукты. Завод играет ключевую роль в обеспечении топливом Центрального региона России. В последние годы на предприятии реализована масштабная программа модернизации, включающая строительство комплекса глубокой переработки нефти, что позволило значительно увеличить выпуск светлых нефтепродуктов и улучшить их качество. ЯНОС сертифицирован по международным стандартам ISO и активно внедряет экологические программы по снижению воздействия на окружающую среду.",1961,"Ярославль, Россия","3,900+",Нефтеперерабатывающая промышленность,Николай Карпов,https://www.yaroslavec.ru
KAZT,"ПАО «КуйбышевАзот» — один из крупнейших производителей минеральных удобрений и химической продукции в России. Компания является ведущим российским производителем капролактама (сырья для производства полиамидов) и аммиака, а также входит в тройку крупнейших производителей аммиачной селитры в стране. Основные направления деятельности включают производство азотных удобрений (аммиачная селитра, карбамид), капролактама и продуктов его переработки (полиамид-6, технические нити и кордная ткань), аммиака и другой химической продукции. Предприятие обладает полным технологическим циклом производства от синтеза аммиака до выпуска конечной продукции. «КуйбышевАзот» играет важную роль в обеспечении сельского хозяйства России минеральными удобрениями, а его продукция экспортируется в более чем 30 стран мира. В последние годы компания реализует масштабную программу модернизации производства, направленную на повышение энергоэффективности и снижение экологической нагрузки. Завод расположен в Тольятти и является градообразующим предприятием.",1966,"Тольятти, Россия","5,100+",Химическая промышленность,Александр Герасименко,https://www.kuazot.ru
KAZTP,"ПАО «КуйбышевАзот» (прив. акции) — один из крупнейших производителей минеральных удобрений и химической продукции в России. Компания является ведущим российским производителем капролактама (сырья для производства полиамидов) и аммиака, а также входит в тройку крупнейших производителей аммиачной селитры в стране. Основные направления деятельности включают производство азотных удобрений (аммиачная селитра, карбамид), капролактама и продуктов его переработки (полиамид-6, технические нити и кордная ткань), аммиака и другой химической продукции. Предприятие обладает полным технологическим циклом производства от синтеза аммиака до выпуска конечной продукции. «КуйбышевАзот» играет важную роль в обеспечении сельского хозяйства России минеральными удобрениями, а его продукция экспортируется в более чем 30 стран мира. В последние годы компания реализует масштабную программу модернизации производства, направленную на повышение энергоэффективности и снижение экологической нагрузки. Завод расположен в Тольятти и является градообразующим предприятием.",1966,"Тольятти, Россия","5,100+",Химическая промышленность,Александр Герасименко,https://www.kuazot.ru
KBSB,"ПАО «ТНС энерго Кубань» (ранее — «Кубаньэнергосбыт») — крупнейшая энергосбытовая компания Краснодарского края, входящая в группу компаний «ТНС энерго». Компания осуществляет деятельность по передаче и сбыту электроэнергии на территории Краснодарского края и Республики Адыгея, обслуживая более 1,5 млн бытовых потребителей и свыше 100 тыс. юридических лиц. «ТНС энерго Кубань» занимает ключевое положение в энергосистеме Южного федерального округа, обеспечивая надежное энергоснабжение одного из наиболее динамично развивающихся регионов России. Компания активно внедряет современные технологии учета электроэнергии (включая интеллектуальные системы АИИС КУЭ), развивает цифровые сервисы для клиентов и реализует программы энергосбережения. В структуру компании входят 11 филиалов, охватывающих всю территорию Краснодарского края. «ТНС энерго Кубань» является дочерним предприятием ПАО «Т Плюс» (входит в группу «Волжский гидроэнергетический каскад») и играет важную роль в реализации стратегии цифровизации электроэнергетики региона.",2006,"Краснодар, Россия","1,200+",Электроэнергетика,Резакова Владислава,https://kuban.tns-e.ru
KCHE,"ПАО «Камчатскэнерго» — ведущая энергетическая компания Камчатского края, обеспечивающая электро- и теплоснабжение региона. Входит в группу «РусГидро» и является основным поставщиком энергии для изолированной энергосистемы полуострова. Компания эксплуатирует 15 электростанций суммарной мощностью 600 МВт, включая ТЭЦ, ГЭС и дизельные электростанции. Основные активы: Петропавловск-Камчатская ТЭЦ-1 и ТЭЦ-2, Мутновская ГеоЭС (крупнейшая геотермальная станция России), а также каскад малых ГЭС. «Камчатскэнерго» обеспечивает энергией более 300 тыс. потребителей, включая стратегически важные объекты Дальнего Востока. Компания активно развивает возобновляемую энергетику (геотермальные и гидроресурсы), что особенно важно для экологии уникального природного региона. В 2022 году запущен проект по переводу дизельных станций на СПГ. Компания играет ключевую роль в социально-экономическом развитии Камчатки, реализуя программы модернизации инфраструктуры и цифровизации энергокомплекса.",1993,"Петропавловск-Камчатский, Россия","4,390+",Электроэнергетика,Новиков Алексей,https://www.kamchatskenergo.ru
KCHEP,"ПАО «Камчатскэнерго» (прив. акции) — ведущая энергетическая компания Камчатского края, обеспечивающая электро- и теплоснабжение региона. Входит в группу «РусГидро» и является основным поставщиком энергии для изолированной энергосистемы полуострова. Компания эксплуатирует 15 электростанций суммарной мощностью 600 МВт, включая ТЭЦ, ГЭС и дизельные электростанции. Основные активы: Петропавловск-Камчатская ТЭЦ-1 и ТЭЦ-2, Мутновская ГеоЭС (крупнейшая геотермальная станция России), а также каскад малых ГЭС. «Камчатскэнерго» обеспечивает энергией более 300 тыс. потребителей, включая стратегически важные объекты Дальнего Востока. Компания активно развивает возобновляемую энергетику (геотермальные и гидроресурсы), что особенно важно для экологии уникального природного региона. В 2022 году запущен проект по переводу дизельных станций на СПГ. Компания играет ключевую роль в социально-экономическом развитии Камчатки, реализуя программы модернизации инфраструктуры и цифровизации энергокомплекса.",1993,"Петропавловск-Камчатский, Россия","4,390+",Электроэнергетика,Новиков Алексей,https://www.kamchatskenergo.ru
KGKC,"ПАО «Курганская генерирующая компания» — ключевой производитель тепловой и электрической энергии в Курганской области. Компания входит в структуру ПАО «Фортум» и обеспечивает энергоснабжение промышленных предприятий и населения региона. Основные производственные активы включают Курганскую ТЭЦ (установленная электрическая мощность — 285 МВт, тепловая — 1 100 Гкал/ч) и разветвлённую тепловую сеть протяжённостью более 300 км. Компания играет важную роль в энергобалансе Уральского региона, обеспечивая надёжное энергоснабжение более 300 тысяч жителей Кургана и области. В последние годы реализована масштабная программа модернизации оборудования, включающая переход на циркулирующий кипящий слой (ЦКС) для сжигания угля, что значительно повысило экологичность производства. Особое внимание уделяется цифровизации процессов управления энергосистемой и внедрению современных технологий учёта энергоресурсов. Компания активно участвует в социальных программах региона, поддерживая развитие спортивной инфраструктуры и образовательных проектов.",2006,"Курган, Россия","2,565+",Электроэнергетика,Прибылев Александр,https://www.fortum.ru
KGKCP,"ПАО «Курганская генерирующая компания» (прив. акции) — ключевой производитель тепловой и электрической энергии в Курганской области. Компания входит в структуру ПАО «Фортум» и обеспечивает энергоснабжение промышленных предприятий и населения региона. Основные производственные активы включают Курганскую ТЭЦ (установленная электрическая мощность — 285 МВт, тепловая — 1 100 Гкал/ч) и разветвлённую тепловую сеть протяжённостью более 300 км. Компания играет важную роль в энергобалансе Уральского региона, обеспечивая надёжное энергоснабжение более 300 тысяч жителей Кургана и области. В последние годы реализована масштабная программа модернизации оборудования, включающая переход на циркулирующий кипящий слой (ЦКС) для сжигания угля, что значительно повысило экологичность производства. Особое внимание уделяется цифровизации процессов управления энергосистемой и внедрению современных технологий учёта энергоресурсов. Компания активно участвует в социальных программах региона, поддерживая развитие спортивной инфраструктуры и образовательных проектов.",2006,"Курган, Россия","2,565+",Электроэнергетика,Прибылев Александр,https://www.fortum.ru
KLSB,"ПАО «Калужская сбытовая компания» (КСБ) - крупнейший гарантирующий поставщик электроэнергии в Калужской области, обеспечивающий энергоснабжение более 400 тысяч потребителей региона. Компания занимает ключевое положение в энергосистеме области, обслуживая как промышленные предприятия (включая резидентов особой экономической зоны «Калуга»), так и население. В зоне ответственности компании - 33 муниципальных образования области с общей численностью населения около 1 млн человек. КСБ активно внедряет интеллектуальные системы учета электроэнергии (АИИС КУЭ), цифровые платформы для взаимодействия с потребителями и системы автоматизированного сбора данных. Особое внимание уделяется работе с крупными промышленными потребителями, включая автомобильные заводы Volkswagen, Volvo и Peugeot. Компания реализует программу цифровой трансформации, включающую внедрение CRM-системы и мобильного приложения для клиентов. В 2022 году компания вошла в ТОП-10 гарантирующих поставщиков России по качеству обслуживания клиентов. КСБ является дочерним предприятием ПАО «Россети Центр» и играет важную роль в социально-экономическом развитии региона.",2004,"Калуга, Россия",378+,Энергосбытовая деятельность,Новикова Галина,https://klsb.rosseti.ru
