secid,description,founded,headquarters,employees,sector,ceo,link
MRSB,"ПАО «Мордовэнергосбыт» - гарантирующий поставщик электроэнергии на территории Республики Мордовия, занимающий ключевую позицию в энергоснабжении региона. Компания осуществляет полный комплекс услуг по продаже электроэнергии населению, предприятиям и бюджетным организациям, обслуживая более 400 тысяч потребителей. Входит в структуру ПАО «ТНС энерго», одного из крупнейших энергосбытовых холдингов России. Особое внимание уделяет цифровизации услуг: внедрена система онлайн-оплаты, личные кабинеты потребителей и автоматизированные системы учета электроэнергии. Компания активно участвует в социальных программах региона, реализует проекты энергосбережения и поддерживает льготные категории потребителей. По итогам 2022 года объем реализованной электроэнергии составил около 3,5 млрд кВт·ч. «Мордовэнергосбыт» играет важную роль в социально-экономическом развитии Республики, обеспечивая стабильное и качественное энергоснабжение.",2005,"Саранск, Республика Мордовия, Россия",390+,Энергосбытовая деятельность,Лялькин Виталий,https://www.mrsk-cp.ru
MSNG,"ПАО «Мосэнерго» — одна из крупнейших генерирующих компаний России и ключевой поставщик тепловой и электрической энергии для Москвы и Московской области. Компания входит в структуру ПАО «Газпром энергохолдинг» и обладает мощностью более 12 ГВт, что составляет около 10% от общей установленной мощности ЕЭС России. «Мосэнерго» эксплуатирует 15 электростанций, включая знаменитую ТЭЦ-20 им. Классона — одну из старейших действующих электростанций страны (введена в 1907 году). Компания обеспечивает около 60% теплоснабжения Москвы, используя современные парогазовые технологии с КПД до 60%. В 2023 году выработка электроэнергии превысила 50 млрд кВт·ч. «Мосэнерго» активно модернизирует оборудование, снижая экологическую нагрузку (выбросы сокращены на 40% за последние 10 лет), и развивает возобновляемую энергетику (проекты по использованию биотоплива). Акции компании входят в первый уровень листинга Московской биржи, капитализация превышает 200 млрд рублей.",1887,"Москва, Россия","8,600+",Электроэнергетика,Александр Бутко,https://www.mosenergo.ru
MSRS,"ПАО «Россети Московский регион» (ранее МОЭСК) - крупнейшая распределительная сетевая компания России, обеспечивающая электроснабжение Москвы и Московской области. Компания обслуживает территорию площадью более 47 тыс. км² с населением свыше 20 млн человек, управляя сетями протяженностью около 600 тыс. км. В зоне ответственности компании находятся более 300 тыс. трансформаторных подстанций и распределительных пунктов. «Россети Московский регион» обеспечивают надежное энергоснабжение таких стратегически важных объектов, как аэропорты, метрополитен, медицинские учреждения и правительственные здания. Компания активно внедряет цифровые технологии, включая систему «умных сетей» (Smart Grid), и реализует масштабную программу модернизации сетевого хозяйства. В 2023 году инвестиции в развитие сетей превысили 50 млрд рублей. Компания входит в группу «Россети» и играет ключевую роль в обеспечении энергетической безопасности столичного региона.",2005,"Москва, Россия","15,250+",Электроэнергетика,Владимир Мясников,https://www.moesk.ru
MSTT,"ПАО «Мостотрест» — одна из ведущих российских специализированных строительных компаний, осуществляющая полный цикл работ в области мостостроения и транспортной инфраструктуры. Компания основана в 1930 году и за свою историю построила более 5000 мостовых сооружений по всей России и за рубежом. «Мостотрест» участвует в реализации ключевых инфраструктурных проектов страны, включая строительство Крымского моста, мостового перехода через Волгу в Саратове, реконструкцию Байкальского тоннеля БАМа. Компания обладает уникальными компетенциями в строительстве сложных инженерных сооружений в труднодоступных регионах и сейсмоопасных зонах. В портфеле текущих проектов — строительство мостовых переходов для высокоскоростной магистрали Москва-Казань. «Мостотрест» входит в структуру ГК «Автодор» и активно внедряет инновационные технологии, включая BIM-моделирование и применение композитных материалов. В 2023 году выручка компании составила более 120 млрд рублей.",1930,"Москва, Россия","16,000+",Машиностроение и транспорт,Чибышев Евгений,https://www.mostotrest.ru
MTLR,"ПАО «Мечел» — одна из ведущих российских горнодобывающих и металлургических компаний с вертикально-интегрированной структурой, объединяющей предприятия по добыче угля, производству железорудного концентрата, стали, проката и ферросплавов. Основанная в 2003 году, компания владеет активами в 11 регионах России, включая такие ключевые производства как Челябинский металлургический комбинат, Белорецкий металлургический комбинат и Эльгинский угольный комплекс — один из крупнейших в мире по запасам коксующегося угля. «Мечел» занимает значительную долю на рынке специальных сталей для машиностроения, судостроения и энергетики, а также является крупным экспортером угля в страны АТР. В 2023 году компания произвела около 5 млн тонн стали и 20 млн тонн угля. Несмотря на долговую нагрузку, «Мечел» продолжает модернизацию производств и развитие Эльгинского месторождения, которое содержит свыше 2,2 млрд тонн угольных запасов. Компания играет важную социально-экономическую роль в регионах присутствия, обеспечивая занятость для более чем 60 тысяч человек.",2003,"Москва, Россия","52,850+",Горнодобывающая и металлургическая промышленность,Олег Коржов,https://www.mechel.ru
MTLRP,"ПАО «Мечел» (прив. акции) — одна из ведущих российских горнодобывающих и металлургических компаний с вертикально-интегрированной структурой, объединяющей предприятия по добыче угля, производству железорудного концентрата, стали, проката и ферросплавов. Основанная в 2003 году, компания владеет активами в 11 регионах России, включая такие ключевые производства как Челябинский металлургический комбинат, Белорецкий металлургический комбинат и Эльгинский угольный комплекс — один из крупнейших в мире по запасам коксующегося угля. «Мечел» занимает значительную долю на рынке специальных сталей для машиностроения, судостроения и энергетики, а также является крупным экспортером угля в страны АТР. В 2023 году компания произвела около 5 млн тонн стали и 20 млн тонн угля. Несмотря на долговую нагрузку, «Мечел» продолжает модернизацию производств и развитие Эльгинского месторождения, которое содержит свыше 2,2 млрд тонн угольных запасов. Компания играет важную социально-экономическую роль в регионах присутствия, обеспечивая занятость для более чем 60 тысяч человек.",2003,"Москва, Россия","52,850+",Горнодобывающая и металлургическая промышленность,Олег Коржов,https://www.mechel.ru
MTSS,"ПАО «МТС» (Мобильные ТелеСистемы) — крупнейший российский телекоммуникационный оператор и провайдер цифровых услуг, входящий в группу компаний АФК «Система». Основанная в 1993 году, компания обслуживает более 86 млн абонентов мобильной связи в России, что составляет около 30% рынка. МТС является технологическим лидером отрасли, первой в России запустившей коммерческие сети 5G в отдельных регионах. Помимо традиционных телекоммуникационных услуг, компания активно развивает направления кибербезопасности (MTS Cyber), облачных вычислений (MTS Cloud), OTT-сервисов (KION, MTS Music), цифрового банкинга (MTS Bank) и IoT-решений. В 2023 году выручка группы составила 550 млрд рублей, из которых более 25% пришлось на цифровые и экосистемные сервисы. МТС владеет разветвленной инфраструктурой, включающей более 250 тыс. базовых станций и 170 тыс. км волоконно-оптических линий связи. Компания регулярно признается самым ценным телеком-брендом России (по оценкам Brand Finance) и занимает лидирующие позиции в ESG-рейтингах отрасли.",1993,"Москва, Россия","26,800+",Телекоммуникации и цифровые услуги, Инесса Галактионова,https://www.mts.ru
MVID,"ПАО «М.Видео» — крупнейшая в России сеть по продаже электроники и бытовой техники, входящая в группу SAFMAR. Компания основана в 1993 году и на сегодняшний день управляет более чем 1000 магазинами в 300+ городах России под брендами «М.Видео» и «Эльдорадо». Компания занимает лидирующие позиции на рынке розничной торговли электроникой с долей около 30%. Ассортимент включает более 30 000 наименований товаров от 1000 мировых и российских брендов. В 2023 году выручка компании превысила 600 млрд рублей. «М.Видео» активно развивает omnichannel-стратегию, где онлайн-продажи составляют более 50% оборота, через собственный маркетплейс и мобильное приложение с 15+ млн активных пользователей. Компания реализует уникальные программы лояльности (клуб «М.Видео» с 25 млн участников) и сервисные решения (установка, подключение, ремонт). В рамках ESG-стратегии «М.Видео» развивает программу утилизации техники и сокращения углеродного следа. Компания входит в топ-10 самых дорогих ритейл-брендов России по версии Brand Finance.",1993,"Москва, Россия",3+,Розничная торговля электроникой и бытовой техникой,Феликс Либ,https://www.mvideo.ru
NAUK,"ПАО «НПО Наука» — ведущее российское предприятие авиационно-космического комплекса, специализирующееся на разработке и производстве систем кондиционирования воздуха, жизнеобеспечения и терморегулирования для авиационной и космической техники. Основанное в 1946 году, предприятие участвовало в оснащении практически всех отечественных гражданских и военных самолетов, включая Sukhoi Superjet 100, МС-21, а также космических кораблей серии «Союз» и орбитальных станций. Компания обладает уникальными технологиями в области создания систем для работы в экстремальных условиях, включая арктическую технику и спецоборудование. В 2023 году выручка составила 12 млрд рублей. «НПО Наука» входит в структуру Госкорпорации Ростех и активно сотрудничает с ведущими мировыми производителями авиатехники. Предприятие располагает современной исследовательской базой и испытательными комплексами, сертифицированными по международным стандартам. Особое внимание уделяется импортозамещению и разработке перспективных систем для новейших российских авиационных проектов.",1931,"Москва, Россия",500+,Авиационно-космическое машиностроение,Смолко Владимир,https://www.npo-nauka.ru
NFAZ,"ПАО «НЕФАЗ» (Нефтекамский автозавод) — крупнейший российский производитель большегрузной автомобильной техники, автобусов и спецтранспорта, входящий в группу «КАМАЗ». Основанный в 1972 году как филиал Камского автозавода, сегодня НЕФАЗ выпускает более 100 моделей техники, включая самосвалы, автобетоносмесители, топливозаправщики, автоцистерны и пассажирские автобусы. Завод занимает около 40% российского рынка большегрузных самосвалов и является ключевым поставщиком техники для нефтегазовой отрасли, горнодобывающего сектора и коммунального хозяйства. В 2023 году предприятие выпустило более 5 000 единиц техники, а выручка превысила 45 млрд рублей. НЕФАЗ активно участвует в программе импортозамещения, локализуя производство ключевых компонентов, и разрабатывает новые модели техники, включая электробусы и машины на газомоторном топливе. Завод располагает современным производственным комплексом площадью 80 га в Нефтекамске (Башкортостан) и обеспечивает занятость для 8 000 человек.",1970,"Нефтекамск, Россия","7,900+",Машиностроение,Владимир Курганов,https://www.nefaz.ru
NKHP,"ПАО «НКХП» (Нижнекамскнефтехим) — один из крупнейших нефтехимических холдингов России и Европы, специализирующийся на производстве синтетических каучуков, пластмасс и других нефтехимических продуктов. Компания входит в группу «ТАИФ» и является ключевым элементом нефтехимического кластера Республики Татарстан. Основные производственные мощности расположены в Нижнекамске, где находится один из самых современных нефтехимических комплексов в мире. НКХП производит более 120 видов продукции, включая 20% мирового производства изопренового каучука и 15% мирового производства бутилового каучука. В 2023 году объем производства превысил 3 млн тонн продукции, а выручка составила более 400 млрд рублей. Компания активно инвестирует в модернизацию производств (проект «Этанол») и развитие экологичных технологий, сократив выбросы на 30% за последние 5 лет. НКХП экспортирует продукцию в 50 стран мира и играет стратегическую роль в импортозамещении полимерных материалов в России.",1893,"Нижнекамск, Россия",600+,Нефтехимическая промышленность,Медведев Юрий,https://www.nknh.ru
NKNC,"ПАО «Нижнекамскнефтехим» (НКНХ) — один из крупнейших нефтехимических холдингов России и Европы, являющийся флагманом нефтехимической отрасли страны. Компания входит в Группу «ТАИФ» и представляет собой мощный производственный комплекс, включающий 20 крупнотоннажных производств. Основные направления деятельности включают производство синтетических каучуков (30% российского рынка), пластмасс (полиэтилен, полипропилен), мономеров и других нефтехимических продуктов. Предприятие обеспечивает около 2% мирового производства каучуков и является единственным в России производителем изопренового каучука. В 2023 году объем производства превысил 3.5 млн тонн продукции, а выручка составила 450 млрд рублей. НКНХ активно реализует масштабную программу модернизации (инвестиции более 200 млрд рублей до 2030 года), включая строительство Этанолового комплекса — одного из крупнейших нефтехимических проектов в Европе. Компания экспортирует продукцию в 50 стран мира и играет ключевую роль в программе импортозамещения полимерных материалов в России.",1967,"Нижнекамск, Республика Татарстан, Россия","17,200+",Нефтехимическая промышленность,Игорь Климов,https://www.nknh.ru
